{"audience":"furatena.preview","binding":{"head_sha":"aaaaaaaaaaaaaaaaaaaaaaaaaaaaaaaaaaaaaaaa","origin":"https://pr-518.preview.example","pull_request_number":518,"repository_id":"repository-4242"},"code":"ccccccccccccccccccccccccccccccccccccccccccc","code_kind":"authorization_code","expires_at":"2030-01-01T00:03:00Z","issued_at":"2030-01-01T00:01:00Z","nonce":"bbbbbbbbbbbbbbbbbbbbbbbbbbbbbbbbbbbbbbbbbbb","poll_interval_seconds":null,"record_type":"furatena.preview-auth.one-time-code","redirect_uri":"https://pr-518.preview.example/_fura/preview-auth/callback","schema_version":1,"subject":"reviewer:stable-pseudonym","user_code":null,"verification_uri":null}
